region,sector,intervention_A_0_Y_0,intervention_A_1_Y_1,intervention_A_2_Y_2
RU,Processing of dairy products,0.003929551486372948,-0.0014583276711702348,0.0031444291481375693
RU,Processed rice,0.0033055401611998677,-0.0014968570154085755,0.0024075717085450888
RU,Sugar refining,0.00040154350776970386,-0.00019649181134998798,0.00028085352117568254
RU,Processing of Food products nec,0.00764203919839859,-0.0028895761194229126,0.0060407299659252164
RU,Manufacture of beverages,0.000968342676460743,-0.0004050932538509369,0.0007328586888313293
RU,Manufacture of fish products,0.025380290197849275,-0.005060222900867462,0.02431998252439499
RU,Manufacture of tobacco products (16),0.0010665288389921188,-0.0005628308520317077,0.0007169382911920547
RU,Manufacture of textiles (17),0.0034522937238961457,-0.0013561996349096299,0.0026717849501520395
RU,Manufacture of wearing apparel; dressing and dyeing of fur (18),0.00043733207879960537,-0.00016560624386370183,0.00034513356555998325
RU,"Tanning and dressing of leather; manufacture of luggage, handbags, saddlery, harness and footwear (19)",0.003201172895669937,-0.0014643200303912163,0.0023671246918439866
RU,"Manufacture of wood and of products of wood and cork, except furniture; manufacture of articles of straw and plaiting materials (20)",0.09080194837760926,-0.06868809393835068,0.04270987428760529
RU,Re-processing of secondary wood material into new wood material,-69.8653046507,-69.8653046507,-69.8653046507
RU,Pulp,0.020027566027998923,-0.012306700796723366,0.011939623655796051
RU,Re-processing of secondary paper into new pulp,-408.2792604,-408.2792604,-408.2792604
RU,Paper,0.02463279325950146,-0.016884085424780846,0.01331477508842945
RU,"Publishing, printing and reproduction of recorded media (22)",0.030577525217056273,-0.010119424065113068,0.0252361687912941
RU,Manufacture of coke oven products,1.0485899950819015,-0.39900870486068724,0.8299040584526062
RU,Petroleum Refinery,4.298433516746521,-1.969440662284851,3.1131971600494386
RU,Processing of nuclear fuel,0.0012929353524968028,-0.0007995307126566767,0.0007835037825107574
RU,"Plastics, basic",0.26318270503902436,-0.22104289317703246,0.11370822514057159
RU,Re-processing of secondary plastic into new plastic,-34.0505814809,-34.0505814809,-34.0505814809
RU,N-fertiliser,0.012780658805251121,-0.008097672046631574,0.007601683822602034
RU,P- and other fertiliser,0.0997802499229908,-0.049952985482215884,0.06972690801095963
RU,Chemicals nec,1.9342168049278259,-1.278882098247528,1.1189727676696777
RU,Manufacture of rubber and plastic products (25),0.004131727070100606,-0.0022720967162027953,0.0027212709608376026
RU,Manufacture of glass and glass products,0.17490896748065948,-0.07057490107536316,0.1364377164373398
RU,Re-processing of secondary glass into new glass,-936.297550409,-936.297550409,-936.297550409
RU,Manufacture of ceramic goods,0.06594293439340591,-0.03238977807331085,0.04548862785434723
RU,"Manufacture of bricks, tiles and construction products, in baked clay",0.008927506147027016,-0.0036293030626773836,0.00680557601416111
RU,"Manufacture of cement, lime and plaster",1.118882677696228,-0.441713873916626,0.8623325764846802
RU,Re-processing of ash into clinker,-148.17237706600002,-148.17237706600002,-148.17237706600002
RU,Manufacture of other non-metallic mineral products n.e.c.,0.4365371249227524,-0.14099619270133973,0.3657440355234146
RU,Manufacture of basic iron and steel and of ferro-alloys and first products thereof,1.2685328154602051,-3.1080634201278685,-0.18292866454315185
RU,Re-processing of secondary steel into new steel,-48348.494357300006,-48348.494357300006,-48348.494357300006
RU,Precious metals production,0.0011605642233490944,-0.0016644560755565763,2.23076393827796e-05
RU,Re-processing of secondary preciuos metals into new preciuos metals,-1.29522506582,-1.29522506582,-1.29522506582
RU,Aluminium production,167.991504620327,-46.87711040166092,144.98982306832505
RU,Re-processing of secondary aluminium into new aluminium,-5434.753537189999,-5434.753537189999,-5434.753537189999
RU,"Lead, zinc and tin production",0.00010830013350769877,-0.0008181958306469024,-0.0006191220639497042
RU,"Re-processing of secondary lead into new lead, zinc and tin",-70.4150120282,-70.4150120282,-70.4150120282
RU,Copper production,0.002116802920497954,-0.06318512445431203,-0.0592833049107641
RU,Re-processing of secondary copper into new copper,-82.6702220977,-82.6702220977,-82.6702220977
RU,Other non-ferrous metal production,24.145202915369033,-6.367477116049289,21.119188517066956
RU,Re-processing of secondary other non-ferrous metals into new other non-ferrous metals,0.0,0.0,0.0
RU,Casting of metals,0.363519273188591,-0.2140574669237137,0.255188255774498
RU,"Manufacture of fabricated metal products, except machinery and equipment (28)",0.1372672489218712,-0.04700839542007446,0.11277023781251908
RU,Manufacture of machinery and equipment n.e.c. (29),0.10657019126081467,-0.03909853626012802,0.08576048802876472
RU,Manufacture of office machinery and computers (30),0.05293816264247894,-0.02477505212211609,0.03737726207399368
RU,Manufacture of electrical machinery and apparatus n.e.c. (31),0.024396586864709854,-0.025151599385619162,0.006489347630620003
RU,"Manufacture of radio, television and communication equipment and apparatus (32)",0.03341188379383087,-0.02098592656826973,0.019147347972631453
RU,"Manufacture of medical, precision and optical instruments, watches and clocks (33)",0.15386625564193726,-0.06755418899154664,0.11543022594070435
RU,"Manufacture of motor vehicles, trailers and semi-trailers (34)",0.03798690115571022,-0.013722106064200401,0.03051687532031536
RU,Manufacture of other transport equipment (35),0.040130907423973086,-0.019560238482236862,0.028369727454900743
RU,Manufacture of furniture; manufacturing n.e.c. (36),0.018135391672611238,-0.006767677687883377,0.01452493858408928
RU,Recycling of waste and scrap,0.24104773134052754,-0.0834675116494894,0.19885746040344238
RU,Recycling of bottles by direct reuse,-3340.29211844,-3340.29211844,-3340.29211844
RU,Production of electricity by coal,0.7748442932970524,-0.2234521106851101,0.6644637856402397
RU,Production of electricity by gas,1.1322501648406982,-0.32835935098123553,0.9691934683289528
RU,Production of electricity by nuclear,0.033952373157039285,-0.009842963322460652,0.029069331166684628
RU,Production of electricity by hydro,0.0744732266728878,-0.021532495105177164,0.06381036553898453
RU,Production of electricity by wind,0.05462726899468899,-0.04334625623750687,0.03176476636779308
RU,Production of electricity by petroleum and other oil derivatives,0.9623481886734963,-0.27908597237300875,0.8222542399554252
RU,Production of electricity by biomass and waste,0.4206147475757599,-0.15119309766197206,0.33833514438819884
RU,Production of electricity by solar photovoltaic,-89.7317006497,-89.7317006497,-89.7317006497
RU,Production of electricity by solar thermal,-1221.3854775799998,-1221.3854775799998,-1221.3854775799998
RU,"Production of electricity by tide, wave, ocean",-7243.87248388,-7243.87248388,-7243.87248388
RU,Production of electricity by Geothermal,0.09611933808517456,-0.03118245898115635,0.08057714942738414
RU,Production of electricity nec,4.132490927606582,-1.203329963804245,3.5276024798908234
RU,Transmission of electricity,0.056584326843500135,-0.01639406718289852,0.048450042064607145
RU,Distribution and trade of electricity,0.026424017542511224,-0.007865553538128733,0.022446952611386777
RU,Manufacture of gas; distribution of gaseous fuels through mains,5.2442847146377565,-1.6094171729278564,4.419212554588318
RU,Steam and hot water supply,46.38023357287598,-16.620351650390624,37.33101617980957
RU,"Collection, purification and distribution of water (41)",0.010975831424951553,-0.003287689673431218,0.009326008869715035
RU,Construction (45),0.03270262848615647,-0.011608212547540665,0.026048873347759245
RU,Re-processing of secondary construction material into aggregates,-48.0742188874,-48.0742188874,-48.0742188874
RU,"Sale, maintenance, repair of motor vehicles, motor vehicles parts, motorcycles, motor cycles parts and accessoiries",0.0341571936211586,-0.01287273818385601,0.027030285223960875
RU,Retail sale of automotive fuel,0.02852935857194662,-0.010999118922173977,0.022705557846546175
RU,"Wholesale trade and commission trade, except of motor vehicles and motorcycles (51)",0.9320867749662399,-0.3353436426668167,0.744911750371933
RU,"Retail trade, except of motor vehicles and motorcycles; repair of personal and household goods (52)",0.05480100129842758,-0.019775112713098526,0.04371225708198547
RU,Hotels and restaurants (55),0.03751890037256479,-0.017717986525952818,0.02648490976727009
RU,Transport via railways,0.9510092816791534,-0.3436706957912445,0.7777177574748992
RU,Other land transport,0.15077365433573722,-0.060091764253377915,0.11523830410456658
RU,Transport via pipelines,19.79735375894165,-7.070385856735229,16.09860184477234
RU,Sea and coastal water transport,2.7087869190177916,-1.2816692214050294,1.8945659170684814
RU,Inland water transport,0.3778463277220726,-0.14456307212924957,0.29582690679597856
RU,Air transport (62),1.8063285693778992,-0.7692642029418946,1.3500468401985168
RU,Supporting and auxiliary transport activities; activities of travel agencies (63),0.0901705804015398,-0.031405659469246866,0.07310624711596966
RU,Post and telecommunications (64),0.05170011711621284,-0.017063543926000596,0.042762899515032766
RU,"Financial intermediation, except insurance and pension funding (65)",0.17968870516467095,-0.06084109204137325,0.146681144500494
RU,"Insurance and pension funding, except compulsory social security (66)",0.12741193662166594,-0.04665338910889626,0.10177726347017288
RU,Activities auxiliary to financial intermediation (67),0.32007842844724654,-0.11424296770191193,0.25693174459791185
RU,Real estate activities (70),0.005187087532058358,-0.001517596012659371,0.004441716845244169
RU,Renting of machinery and equipment without operator and of personal and household goods (71),0.005771254868805409,-0.006782503203049302,0.0004429158197566867
RU,Computer and related activities (72),0.17791040443515777,-0.19343906564044952,0.038670253133773806
RU,Research and development (73),0.25085059189414977,-0.12726909669303893,0.16893486487770082
RU,Other business activities (74),0.13133228621912002,-0.1271185040512085,0.03379882988381386
RU,Public administration and defence; compulsory social security (75),0.027480340580940246,-0.009381834562540055,0.022396003507852553
RU,Education (80),0.1351503225927353,-0.04304272265625,0.11243722969722748
RU,Health and social work (85),0.018746182708263396,-0.006702969662189483,0.015025552614212036
RU,Incineration of waste: Food,0.0007655180605873465,-0.00027893355440534654,0.0006084869868364186
RU,Incineration of waste: Paper,7.268157695315313e-05,-2.666522239567712e-05,5.756474866799544e-05
RU,Incineration of waste: Plastic,0.8171363014431,-0.2797357668094635,0.6636803610134124
RU,Incineration of waste: Metals and Inert materials,0.3126162824783325,-0.1292964768486023,0.23463494377565383
RU,Incineration of waste: Textiles,0.9937105660877228,-0.34962609649944304,0.8005659478578567
RU,Incineration of waste: Wood,1.1641197730350542e-05,-4.733582693093922e-06,8.855058399203698e-06
RU,Incineration of waste: Oil/Hazardous waste,0.4720533411841393,-0.1634494014763832,0.3833287026023865
RU,"Biogasification of food waste, incl. land application",0.0,0.0,0.0
RU,"Biogasification of paper, incl. land application",0.0,0.0,0.0
RU,"Biogasification of sewage slugde, incl. land application",0.0,0.0,0.0
RU,"Composting of food waste, incl. land application",0.0,0.0,0.0
RU,"Composting of paper and wood, incl. land application",0.0,0.0,0.0
RU,"Waste water treatment, food",0.07431247571992874,-0.026768175070285796,0.05930225377345085
RU,"Waste water treatment, other",0.1123114309129715,-0.04053488230419159,0.08955739719176292
RU,Landfill of waste: Food,5.395647857376098,-1.9264249518890382,4.3245856622467045
RU,Landfill of waste: Paper,0.8974227868423462,-0.30353391979599,0.7331554940891266
RU,Landfill of waste: Plastic,0.5499574292259216,-0.19502704112148284,0.4417578590126038
RU,Landfill of waste: Inert/metal/hazardous,0.021741174744039773,-0.007536455797046423,0.017587707444399595
RU,Landfill of waste: Textiles,0.11279295208120346,-0.03878115300750733,0.09152299681544304
RU,Landfill of waste: Wood,0.7382947545623779,-0.2638028676586151,0.5908373116531372
RU,Activities of membership organisation n.e.c. (91),0.00016707849313691257,-6.103977387398481e-05,0.00013262077386304736
RU,"Recreational, cultural and sporting activities (92)",0.03809587958240509,-0.014912753982067109,0.02946571746635437
RU,Other service activities (93),0.0004745127306059003,-0.00045830400037579237,0.00012317123822961002
RU,Private households with employed persons (95),1.7856541089713573e-07,-2.2251549363136292e-07,1.4819514006376266e-08
RU,Extra-territorial organizations and bodies,0.0,0.0,0.0
AU,Cultivation of paddy rice,0.015719819271564482,-0.015502827507257462,0.004834377696990967
AU,Cultivation of wheat,0.4335478989028931,-0.27256157947921755,0.25733352953147887
AU,Cultivation of cereal grains nec,0.09686040100765228,-0.06956211027669906,0.050837740475654605
AU,"Cultivation of vegetables, fruit, nuts",0.06442366680908203,-0.04715694548225403,0.03321276229095459
AU,Cultivation of oil seeds,0.02202224856567383,-0.028529756085753442,0.0008784214859008789
AU,"Cultivation of sugar cane, sugar beet",0.00965127596437931,-0.010260522307276726,0.0023785313775539396
AU,Cultivation of plant-based fibers,0.0261032171779871,-0.026632817469239234,0.0070652320870161055
AU,Cultivation of crops nec,0.0013634290090799332,-0.0011979225474894046,0.0005296082547307015
AU,Cattle farming,0.7193396139831543,-0.6786251450500488,0.24545346115112304
AU,Pigs farming,0.007102820888996124,-0.00646015997838974,0.002598731728553772
AU,Poultry farming,0.017739329235076904,-0.014338220845937728,0.00808573738002777
AU,Meat animals nec,0.020089078891396522,-0.017759466539382936,0.007949890511870384
AU,Animal products nec,1.4521154369693249e-05,-1.244932743627578e-05,5.990278101526201e-06
AU,Raw milk,0.11726215201187133,-0.1208914988822937,0.03172987631225586
AU,"Wool, silk-worm cocoons",0.053346056709289554,-0.07375368599319458,0.006865188217163086
AU,"Manure treatment (conventional), storage and land application",-7852.30641885,-7852.30641885,-7852.30641885
AU,"Manure treatment (biogas), storage and land application",-0.0297762961171,-0.0297762961171,-0.0297762961171
AU,"Forestry, logging and related service activities (02)",0.0037903834710121156,-0.0029191094142198564,0.0020642792835235597
AU,"Fishing, operating of fish hatcheries and fish farms; service activities incidental to fishing (05)",0.0003063693956900388,-0.0002637653640117496,0.00012541520158573986
AU,Mining of coal and lignite; extraction of peat (10),11.18791069970703,-2.4377804768829345,10.646227173950196
AU,"Extraction of crude petroleum and services related to crude oil extraction, excluding surveying",0.21802095986938477,-0.1581655163974762,0.11396620416259766
AU,"Extraction of natural gas and services related to natural gas extraction, excluding surveying",0.057479008472442625,-0.05681714428520203,0.018155233030319212
AU,"Extraction, liquefaction, and regasification of other petroleum and gaseous materials",0.05350862981510162,-0.03987910925197601,0.027828509300231934
AU,Mining of uranium and thorium ores (12),0.003254194967985153,-0.0024529645911455155,0.001632409422636032
AU,Mining of iron ores,-0.1067930880832672,-0.06480521218490601,-0.09330377245426177
AU,Mining of copper ores and concentrates,0.004598959874391555,-0.013316825208306312,-0.006442234163165092
AU,Mining of nickel ores and concentrates,0.022195932762343436,-0.006195188477367163,0.019151121570043266
AU,Mining of aluminium ores and concentrates,0.1188581824964881,-0.04049652645432949,0.09719720668745041
AU,Mining of precious metal ores and concentrates,0.0008743256247341633,-0.003405227766275406,-0.0017952243984043598
AU,"Mining of lead, zinc and tin ores and concentrates",-0.00486069734312594,-0.01227642855155468,-0.016041131167903542
AU,Mining of other non-ferrous metal ores and concentrates,0.20948058055233956,-0.14728469614857434,0.09659583886295557
AU,Quarrying of stone,0.007539175880968571,-0.006916701472759247,0.0029523564415574076
AU,Quarrying of sand and clay,0.029081267775297164,-0.024350501511335373,0.013484922861099244
AU,"Mining of chemical and fertilizer minerals, production of salt, other mining and quarrying n.e.c.",0.0022565572335571053,-0.00386106010748446,-0.0004405684450864792
AU,Processing of meat cattle,0.0008583987262845039,-0.0009952719272971152,0.00014047993636131286
AU,Processing of meat pigs,0.0006368698422387243,-0.0005898893904909492,0.0002188752132281661
AU,Processing of meat poultry,0.0005277117499932647,-0.0005061099598482251,0.00017506842571496964
AU,Production of meat products nec,0.001233745811700821,-0.0010310904583334924,0.0005321112650334835
AU,Processing vegetable oils and fats,0.0008036981106102467,-0.0006181323608402163,0.0003879415133073926
AU,Processing of dairy products,0.002204190808296204,-0.002021348500728607,0.000801867537021637
AU,Processed rice,0.002170999110430479,-0.0022189347156882284,0.0006031557721793651
AU,Sugar refining,0.0009047156352549791,-0.0009637819313406944,0.00022061107122898103
AU,Processing of Food products nec,0.002285688504219055,-0.0025417634921073916,0.00048416882085800173
AU,Manufacture of beverages,0.007527229744315148,-0.005861360456347465,0.003638374749779701
AU,Manufacture of fish products,0.00019864723136276007,-0.00018662676957249643,6.945931147783995e-05
AU,Manufacture of tobacco products (16),0.00028767556655406954,-0.00020840622832626104,0.000149516713835299
AU,Manufacture of textiles (17),0.00041909439170360565,-0.0006620576454102993,-7.134657281637192e-05
AU,Manufacture of wearing apparel; dressing and dyeing of fur (18),0.00131302700522542,-0.0010079688063561916,0.0006633681694865227
AU,"Tanning and dressing of leather; manufacture of luggage, handbags, saddlery, harness and footwear (19)",0.0002603815522771329,-0.00019435968026611954,0.00013073969180975108
AU,"Manufacture of wood and of products of wood and cork, except furniture; manufacture of articles of straw and plaiting materials (20)",0.0007566788628399372,-0.000829711638122797,0.00018210176634788513
AU,Re-processing of secondary wood material into new wood material,0.000170461456310004,-0.00012704214372858406,8.865276943519712e-05
AU,Pulp,0.0021735640342384578,-0.0018031127382665873,0.0009252626177072525
AU,Re-processing of secondary paper into new pulp,6.310843938030302e-05,-4.703369078598916e-05,3.2821131808683274e-05
AU,Paper,0.002770578855395317,-0.0028248381931185724,0.0007904358339905739
AU,"Publishing, printing and reproduction of recorded media (22)",0.003981242927312851,-0.0030736194998025896,0.0019381256773471833
AU,Manufacture of coke oven products,0.028146976897597313,-0.04649887288951874,-0.0038667831922769547
AU,Petroleum Refinery,0.09257525519561767,-0.06162966869163513,0.053786652702331544
AU,Processing of nuclear fuel,5.031183796189725e-05,-3.7964374857023356e-05,2.2918607849627735e-05
AU,"Plastics, basic",0.0005401444458961487,-0.008379024840682744,-0.006114944156229496
AU,Re-processing of secondary plastic into new plastic,0.0017401659300029279,-0.0012969172914028167,0.000905017077177763
AU,N-fertiliser,0.0001902354632820934,-0.00014971856969641522,8.364221676578746e-05
AU,P- and other fertiliser,0.009569367327988148,-0.006786206169366837,0.005235050395131111
AU,Chemicals nec,0.1176356329202652,-0.08892459718608856,0.05839105542182922
AU,Manufacture of rubber and plastic products (25),2.6989562014117836e-05,-0.00012832689323648812,-7.26187095772475e-05
AU,Manufacture of glass and glass products,0.01817028641462326,-0.016768546992063524,0.00693968593120575
AU,Re-processing of secondary glass into new glass,-380.74859202600004,-380.74859202600004,-380.74859202600004
AU,Manufacture of ceramic goods,0.0036820071811676023,-0.003276545052409172,0.0013861889638900756
AU,"Manufacture of bricks, tiles and construction products, in baked clay",0.002552491315841675,-0.0015425342631042005,0.0015883645376563072
AU,"Manufacture of cement, lime and plaster",0.04222458107471466,-0.027620064188957214,0.025347180750846864
AU,Re-processing of ash into clinker,0.00013235543894581496,-9.864235037006438e-05,6.88347762990743e-05
AU,Manufacture of other non-metallic mineral products n.e.c.,0.004084894187867641,-0.0020966778644919398,0.0028807117707133293
AU,Manufacture of basic iron and steel and of ferro-alloys and first products thereof,0.0044068286108970645,-0.029228802914619444,-0.013923686571121216
AU,Re-processing of secondary steel into new steel,-515.323025437,-515.323025437,-515.323025437
AU,Precious metals production,-0.019658059529781342,-0.07200999525260925,-0.07582228016328811
AU,Re-processing of secondary preciuos metals into new preciuos metals,7.461863539088518e-05,-5.561205217801034e-05,3.880729885958135e-05
AU,Aluminium production,1.709982729543686,-0.59891778668499,1.3897525936470032
AU,Re-processing of secondary aluminium into new aluminium,0.010579918723464012,-0.0078850409014225,0.005502352939486504
AU,"Lead, zinc and tin production",0.005206547376155854,-0.010071940346121787,-0.0021852343516349793
AU,"Re-processing of secondary lead into new lead, zinc and tin",0.0004714626713320613,-0.0003513734409734607,0.00024519602496922015
AU,Copper production,-0.012531870329856873,-0.03688422928059101,-0.044155799011826515
AU,Re-processing of secondary copper into new copper,0.0002919550460577011,-0.00021758933501690627,0.00015183856776356696
AU,Other non-ferrous metal production,2.652640092442989,-0.7500135872592926,2.2796237140352726
AU,Re-processing of secondary other non-ferrous metals into new other non-ferrous metals,5.563388816546649e-05,-4.1463029647246e-05,2.8933803376741707e-05
AU,Casting of metals,0.0009005302683264018,-0.0008251028344333172,0.0003777472829967737
AU,"Manufacture of fabricated metal products, except machinery and equipment (28)",0.0003308281447589397,-0.0015957618861794471,-0.000693301177173853
AU,Manufacture of machinery and equipment n.e.c. (29),-0.001517404335618019,-0.0035882819929122923,-0.003729083256304264
AU,Manufacture of office machinery and computers (30),0.005322048435270787,-0.004790049873650074,0.0019420209948718549
AU,Manufacture of electrical machinery and apparatus n.e.c. (31),0.0004076106317490339,-0.0009835335042476653,-0.0003252618561685085
AU,"Manufacture of radio, television and communication equipment and apparatus (32)",0.002825985543012619,-0.009044279767036438,-0.004490823931455612
AU,"Manufacture of medical, precision and optical instruments, watches and clocks (33)",-0.004807395539164543,-0.005238328349471092,-0.008578034530282021
AU,"Manufacture of motor vehicles, trailers and semi-trailers (34)",0.00045824364629387855,-0.00040051134771108626,0.00018633470624685288
AU,Manufacture of other transport equipment (35),0.0030578189490437506,-0.00209784061729908,0.0017554453729391097
AU,Manufacture of furniture; manufacturing n.e.c. (36),9.351682576537133e-05,-0.0004146093887388706,-0.00019635296142101288
AU,Recycling of waste and scrap,0.022156198266506194,-0.031084192586898804,0.0010818196444511415
AU,Recycling of bottles by direct reuse,-1492.49797032,-1492.49797032,-1492.49797032
AU,Production of electricity by coal,3.76037077722168,-1.7182944031066893,2.7646593263549804
AU,Production of electricity by gas,0.47369594112205504,-0.22072966254997253,0.34386291680145264
AU,Production of electricity by nuclear,-0.0909943357716,-0.0909943357716,-0.0909943357716
AU,Production of electricity by hydro,0.0002797129331044853,-0.000126553005060181,0.0002062162966094911
AU,Production of electricity by wind,0.0010426563671901822,-0.0005110453244298697,0.0007381558335870504
AU,Production of electricity by petroleum and other oil derivatives,0.023452300199747086,-0.010668381068229675,0.017236110086083414
AU,Production of electricity by biomass and waste,0.019887352305173873,-0.010714370762348175,0.0134484745554924
AU,Production of electricity by solar photovoltaic,2.3028498577827123e-05,-1.0522772121999879e-05,1.6861110344994813e-05
AU,Production of electricity by solar thermal,7.122576046003815e-08,-4.0734809923378637e-08,4.568844724553856e-08
AU,"Production of electricity by tide, wave, ocean",-2.93722241714e-16,-2.93722241714e-16,-2.93722241714e-16
AU,Production of electricity by Geothermal,-0.0553363180538,-0.0553363180538,-0.0553363180538
AU,Production of electricity nec,1.8604222599067725e-05,-8.47476114355959e-06,1.3687225289642811e-05
AU,Transmission of electricity,1.8884687192912679e-06,-9.797383529075887e-07,1.311275693908101e-06
AU,Distribution and trade of electricity,3.2827978466637435e-05,-1.7737503122538328e-05,2.2337967086583378e-05
AU,Manufacture of gas; distribution of gaseous fuels through mains,0.07104788060379029,-0.052168712455749514,0.03798976864528656
AU,Steam and hot water supply,-3877.4190955599997,-3877.4190955599997,-3877.4190955599997
AU,"Collection, purification and distribution of water (41)",5.2998191565275195e-06,-3.722315128194168e-06,2.9765045328531415e-06
AU,Construction (45),0.005219108842372895,-0.0034496291570663452,0.0032062818953990935
AU,Re-processing of secondary construction material into aggregates,-1.38889278873,-1.38889278873,-1.38889278873
AU,"Sale, maintenance, repair of motor vehicles, motor vehicles parts, motorcycles, motor cycles parts and accessoiries",0.0016882982261180878,-0.0011911866303384304,0.0009224482078552247
AU,Retail sale of automotive fuel,5.2422466422896834e-05,-3.89846995822154e-05,2.8159674839116635e-05
AU,"Wholesale trade and commission trade, except of motor vehicles and motorcycles (51)",0.005362997469961643,-0.002813209668546915,0.003663218778461218
