region,sector,intervention_A_0_Y_0,intervention_A_1_Y_1,intervention_A_2_Y_2
GR,"Manufacture of radio, television and communication equipment and apparatus (32)",1.9115195194259287e-05,-0.00012662403009366244,-8.844903987832367e-05
GR,"Manufacture of medical, precision and optical instruments, watches and clocks (33)",-6.661366518959403e-05,-7.627967639826238e-05,-0.00012131221958436072
GR,"Manufacture of motor vehicles, trailers and semi-trailers (34)",0.000411263517729938,-0.0005481696406230331,-4.935944430530072e-06
GR,Manufacture of other transport equipment (35),2.3977198763750493e-06,-1.950318542122841e-05,-1.3721165847498923e-05
GR,Manufacture of furniture; manufacturing n.e.c. (36),0.00648916088360548,-0.004346673953831196,0.00374144529658556
GR,Recycling of waste and scrap,7.125250100943959e-08,-1.0550899630470668e-07,-8.876782485458535e-09
GR,Recycling of bottles by direct reuse,6.679723552102223e-05,-0.0002671484446669929,-0.00015623997082933784
GR,Production of electricity by coal,2.562834377429962,-0.8555975041046142,2.107757144985199
GR,Production of electricity by gas,0.5637510101518631,-0.19253632807826995,0.4599811673240662
GR,Production of electricity by nuclear,-0.00017708494691800003,-0.00017708494691800003,-0.00017708494691800003
GR,Production of electricity by hydro,1.471268138004234e-05,-5.326928641530685e-06,1.1766770797752542e-05
GR,Production of electricity by wind,3.6382946609155622e-06,-1.3169078204446123e-06,2.9101121773928754e-06
GR,Production of electricity by petroleum and other oil derivatives,0.20364051616048812,-0.07379997020578384,0.16280809672403335
GR,Production of electricity by biomass and waste,2.5211975169659127e-06,-9.121915223513497e-07,2.0169150727888335e-06
GR,Production of electricity by solar photovoltaic,0.00017505141522129999,-8.43827621084638e-05,0.0001233003401067108
GR,Production of electricity by solar thermal,-2.85371523701,-2.85371523701,-2.85371523701
GR,"Production of electricity by tide, wave, ocean",0.0,0.0,0.0
GR,Production of electricity by Geothermal,-0.180330151724,-0.180330151724,-0.180330151724
GR,Production of electricity nec,-2.54726513718,-2.54726513718,-2.54726513718
GR,Transmission of electricity,0.003910143587231636,-0.001457427594229579,0.003094005811139941
GR,Distribution and trade of electricity,0.0,0.0,0.0
GR,Manufacture of gas; distribution of gaseous fuels through mains,0.0010668569971248507,-0.0003999332531020045,0.0008430722096413374
GR,Steam and hot water supply,0.18613233681678773,-0.16977551064300536,0.061015429561614994
GR,"Collection, purification and distribution of water (41)",2.7554699232801794e-05,-1.7247756575234234e-05,1.6317643699236213e-05
GR,Construction (45),0.0002435894961953163,-0.00022785631561279298,7.620985358953476e-05
GR,Re-processing of secondary construction material into aggregates,0.0,0.0,0.0
GR,"Sale, maintenance, repair of motor vehicles, motor vehicles parts, motorcycles, motor cycles parts and accessoiries",0.00028823867704719306,-0.00015621624832972883,0.00018793624271079898
GR,Retail sale of automotive fuel,2.484333834797144e-05,-1.5803212597267703e-05,1.4540961919818074e-05
GR,"Wholesale trade and commission trade, except of motor vehicles and motorcycles (51)",0.00041669761304184797,-0.000384168401427567,0.00016039219287782908
GR,"Retail trade, except of motor vehicles and motorcycles; repair of personal and household goods (52)",0.00011324139869771897,-7.684532729722559e-05,6.362353525683283e-05
GR,Hotels and restaurants (55),0.0036284655233621596,-0.007006008224129677,-0.0016940508425831796
GR,Transport via railways,0.00039330953374505043,-0.00021625039245188235,0.000257160509288311
GR,Other land transport,0.00011438607822544873,-9.60344673357904e-05,4.5105468874797226e-05
GR,Transport via pipelines,0.0,0.0,0.0
GR,Sea and coastal water transport,0.3137603960113525,-0.6824596691131591,-0.21001610371398927
GR,Inland water transport,0.00587438942527771,-0.010179301534891128,-0.0017054972529411316
GR,Air transport (62),0.01500984734749794,-0.013266333180189133,0.005534462047338486
GR,Supporting and auxiliary transport activities; activities of travel agencies (63),0.0006091200416535139,-0.0005864900759905577,0.00018821482281386852
GR,Post and telecommunications (64),0.0008991612903475762,-0.0007100836370587349,0.00039496279980242254
GR,"Financial intermediation, except insurance and pension funding (65)",0.006437544777214527,-0.0028190829313397407,0.004749235140502453
GR,"Insurance and pension funding, except compulsory social security (66)",0.00035847421539202335,-0.000267709963504225,0.0001758568977303803
GR,Activities auxiliary to financial intermediation (67),0.0005069944130517542,-0.00033673389795422555,0.0002789641760289669
GR,Real estate activities (70),0.0002470539572387934,-0.0003106065154224634,2.4300083309412003e-05
GR,Renting of machinery and equipment without operator and of personal and household goods (71),0.0006961222997121513,-0.0006264912798143923,0.0002335668422654271
GR,Computer and related activities (72),0.00015994165112450718,-0.00011615318639576435,8.160896969027817e-05
GR,Research and development (73),-9.259714808687568e-05,-0.00022004801996797324,-0.00027148027778230605
GR,Other business activities (74),0.009730067894995212,-0.005151149802744388,0.006439660524666309
GR,Public administration and defence; compulsory social security (75),0.0009333614897578954,-0.0006033005785495043,0.0005384384147524834
GR,Education (80),2.688135788589716e-05,-1.4690081991255284e-05,1.740782567113638e-05
GR,Health and social work (85),3.6329575523734095e-05,-2.2995567455887793e-05,2.1254481971263884e-05
GR,Incineration of waste: Food,3.1685416421822763e-09,-2.1612807934303645e-09,1.7650618594160505e-09
GR,Incineration of waste: Paper,3.265065604409756e-07,-2.2271203528453042e-07,1.8188313166410807e-07
GR,Incineration of waste: Plastic,3.3044579333945874e-06,-2.253990090903244e-06,1.8407751334743807e-06
GR,Incineration of waste: Metals and Inert materials,0.0024346527175754308,-0.0012965790694206953,0.0016129761953055858
GR,Incineration of waste: Textiles,2.4350733636380184e-11,-1.6609777890641552e-11,1.3564773969854116e-11
GR,Incineration of waste: Wood,0.0,0.0,0.0
GR,Incineration of waste: Oil/Hazardous waste,0.0016737863209545611,-0.0016116574323028327,0.0005418926242887974
GR,"Biogasification of food waste, incl. land application",0.0,0.0,0.0
GR,"Biogasification of paper, incl. land application",0.0,0.0,0.0
GR,"Biogasification of sewage slugde, incl. land application",5.54358246922493e-06,-4.3008339358493686e-06,2.6025681809987874e-06
GR,"Composting of food waste, incl. land application",8.265431694104335e-06,-7.41243280924391e-06,3.0906822745455428e-06
GR,"Composting of paper and wood, incl. land application",0.0,0.0,0.0
GR,"Waste water treatment, food",0.0018127933653146028,-0.0017161893024593591,0.0005985786555856466
GR,"Waste water treatment, other",0.0018899674254357814,-0.0016572849577069283,0.0007287810806632042
GR,Landfill of waste: Food,0.0364523175573349,-0.03875216818332672,0.00842218881702423
GR,Landfill of waste: Paper,0.003938919774979353,-0.0033163513307869433,0.001625697925388813
GR,Landfill of waste: Plastic,0.00028324204649403693,-0.00028996527840569617,7.724577953666449e-05
GR,Landfill of waste: Inert/metal/hazardous,6.530855425307527e-05,-3.9226523391436786e-05,3.9648043838795276e-05
GR,Landfill of waste: Textiles,0.0011112769444286824,-0.0007494655778706074,0.0006008398187160492
GR,Landfill of waste: Wood,0.0011182545887082815,-0.0012569638079032303,0.000203902543887496
GR,Activities of membership organisation n.e.c. (91),4.5496287882328036e-05,-2.9680337317287923e-05,2.5707315541803837e-05
GR,"Recreational, cultural and sporting activities (92)",0.00013876893222332002,-8.775433691591024e-05,8.033317549526691e-05
GR,Other service activities (93),2.775202950462699e-06,-2.270557016134262e-06,1.164169592782855e-06
GR,Private households with employed persons (95),2.6022996361367403e-05,-2.825600088853389e-05,6.101314315572381e-06
GR,Extra-territorial organizations and bodies,0.0,0.0,0.0
HR,Cultivation of paddy rice,1.0072013091295957e-05,-8.47184531763196e-06,4.246503684669733e-06
HR,Cultivation of wheat,0.0020450313259363175,-0.0016820340974330902,0.0008782449738383293
HR,Cultivation of cereal grains nec,0.004735406310677528,-0.003696598258256912,0.0022154330340623854
HR,"Cultivation of vegetables, fruit, nuts",0.00029101205192506315,-0.00027222417698800563,9.823110701143742e-05
HR,Cultivation of oil seeds,0.0002410543346554041,-0.00019457486833631993,0.00010769213315844536
HR,"Cultivation of sugar cane, sugar beet",0.0004870368766188621,-0.0008261133616939187,-0.00011291048612445593
HR,Cultivation of plant-based fibers,0.00012391453866660596,-0.00010501871162652969,4.9341708958148956e-05
HR,Cultivation of crops nec,0.00041292713122069837,-0.0003595261595919728,0.00015816423193365335
HR,Cattle farming,0.008398711665511132,-0.006045782682001591,0.004381840717732907
HR,Pigs farming,0.0010682793955802917,-0.0011529076505303383,0.00023669529655575753
HR,Poultry farming,0.0012418356412053108,-0.0012290471555888652,0.0003871636470556259
HR,Meat animals nec,0.0010302993098497391,-0.0010479330447316169,0.00027145932261645795
HR,Animal products nec,7.373565976973623e-06,-7.5916869710199535e-06,1.929685215232894e-06
HR,Raw milk,0.006862703033447265,-0.00897374467086792,0.0002528388025760651
HR,"Wool, silk-worm cocoons",7.109429190587253e-05,-6.935538393817843e-05,2.0526819818653166e-05
HR,"Manure treatment (conventional), storage and land application",-109.187762694,-109.187762694,-109.187762694
HR,"Manure treatment (biogas), storage and land application",-14.135315179700001,-14.135315179700001,-14.135315179700001
HR,"Forestry, logging and related service activities (02)",0.0008354717271775007,-0.0008822279247939586,0.00020778331078588963
HR,"Fishing, operating of fish hatcheries and fish farms; service activities incidental to fishing (05)",0.0002369445470944047,-0.00040012288408726454,-6.372903985530138e-05
HR,Mining of coal and lignite; extraction of peat (10),0.0017156410007663071,-0.0008278227188251913,0.0012002332345731556
HR,"Extraction of crude petroleum and services related to crude oil extraction, excluding surveying",0.030113072452962398,-0.01348399842709303,0.0220054187297225
HR,"Extraction of natural gas and services related to natural gas extraction, excluding surveying",0.02862235653710365,-0.014930877823233605,0.019346926710486413
HR,"Extraction, liquefaction, and regasification of other petroleum and gaseous materials",-0.447913320174,-0.447913320174,-0.447913320174
HR,Mining of uranium and thorium ores (12),1.053501796151977e-06,-1.123463944226387e-06,1.9890044872590805e-07
HR,Mining of iron ores,8.579712328268215e-06,-2.9076603356865233e-05,-1.482790105312597e-05
HR,Mining of copper ores and concentrates,6.218307517748325e-05,-0.0009621690706135705,-0.0008597073666732759
HR,Mining of nickel ores and concentrates,4.542886958166492e-06,-7.919121874729172e-06,-7.831377350375988e-07
HR,Mining of aluminium ores and concentrates,1.7509483086760157e-06,-1.0431052239146084e-06,9.754261277557817e-07
HR,Mining of precious metal ores and concentrates,1.4409541302127764e-05,-0.00022242718457605225,-0.00019869266013358719
HR,"Mining of lead, zinc and tin ores and concentrates",2.6614325059344994e-06,-1.621345144638326e-05,-1.2495456114091212e-05
HR,Mining of other non-ferrous metal ores and concentrates,1.2678194431209704e-06,-1.9582547764395714e-05,-1.7492219451523852e-05
HR,Quarrying of stone,7.141639124043285e-05,-0.0011050397415878252,-0.000987363873177208
HR,Quarrying of sand and clay,0.001440675929635763,-0.0012791697521805764,0.0005341996822506189
HR,"Mining of chemical and fertilizer minerals, production of salt, other mining and quarrying n.e.c.",6.734887847583741e-05,-5.5478289787191896e-05,2.7697987363208086e-05
HR,Processing of meat cattle,1.4714608929585666e-05,-1.9085629783337935e-05,7.185222352854907e-07
HR,Processing of meat pigs,1.965413903305307e-05,-2.5671264454722405e-05,9.783195918425918e-07
HR,Processing of meat poultry,2.5206908501684665e-05,-3.632503979280591e-05,-1.7294101156294345e-06
HR,Production of meat products nec,1.9585707020014525e-05,-2.517118526995182e-05,1.191677238792181e-06
HR,Processing vegetable oils and fats,0.0001737191001661122,-0.00014884324615821242,6.951991394162177e-05
HR,Processing of dairy products,0.0003387087635695934,-0.0010611265459060668,-0.0004898146451711655
HR,Processed rice,6.800706991739571e-05,-6.032368754595518e-05,2.571737522818148e-05
HR,Sugar refining,3.247278843447566e-05,-4.9079659964889286e-05,-3.8856039345264435e-06
HR,Processing of Food products nec,0.0011303535875976085,-0.0012675676847100257,0.00020837375596165656
HR,Manufacture of beverages,0.0008657384117245674,-0.0009128505840748549,0.00020777520468831062
HR,Manufacture of fish products,2.1865820463746786e-05,-7.095639456575736e-05,-3.364807107439265e-05
HR,Manufacture of tobacco products (16),6.99147920012474e-05,-9.841673025488853e-05,-3.093675218522549e-06
HR,Manufacture of textiles (17),-3.113654524087906e-06,-0.00017869974114000797,-0.00014566400585323572
HR,Manufacture of wearing apparel; dressing and dyeing of fur (18),7.262887619435787e-05,-0.00022806507575511933,-9.576506757736206e-05
HR,"Tanning and dressing of leather; manufacture of luggage, handbags, saddlery, harness and footwear (19)",4.82563284933567e-05,-5.5791396347805855e-05,8.885448755696417e-06
HR,"Manufacture of wood and of products of wood and cork, except furniture; manufacture of articles of straw and plaiting materials (20)",0.00024231766494363548,-0.00037785798658058047,-3.5091179985553025e-05
HR,Re-processing of secondary wood material into new wood material,2.246586466487497e-05,-3.6953388906084e-05,-4.800945205613971e-06
HR,Pulp,0.0002826600697990507,-0.00018170030516386033,0.00016040786275081336
HR,Re-processing of secondary paper into new pulp,0.00029259466153755783,-0.00018775437526218593,0.00016633764229528607
HR,Paper,0.0004814061353318393,-0.0003937137770652771,0.0002068840119726956
HR,"Publishing, printing and reproduction of recorded media (22)",0.0007692791511118412,-0.0012732673698812723,-0.00018845931634306907
HR,Manufacture of coke oven products,2.3362980110105127e-05,-2.3803158718626945e-05,6.193129994440824e-06
HR,Petroleum Refinery,0.1627463753619194,-0.06689510440826416,0.12331755026698113
HR,Processing of nuclear fuel,0.0001023647506609559,-8.500347536802291e-05,4.335604915767908e-05
HR,"Plastics, basic",0.003795151212185621,-0.0031228371482789515,0.001561672592625022
HR,Re-processing of secondary plastic into new plastic,0.003519587402500212,-0.0022522403648272157,0.001993434887304902
HR,N-fertiliser,5.294956495380029e-05,-4.807431892445311e-05,1.8607227417640387e-05
HR,P- and other fertiliser,0.0002679825746119022,-0.00020545973812788725,0.00012740050595253706
HR,Chemicals nec,0.006773271493554115,-0.004042713560461998,0.004088174162715673
HR,Manufacture of rubber and plastic products (25),-3.534606858110055e-05,-0.00016264348719874396,-0.00017043074671411888
HR,Manufacture of glass and glass products,3.438526606652886e-05,-6.463401117827744e-05,-1.2384394480846823e-05
HR,Re-processing of secondary glass into new glass,2.2041639904957264e-05,-3.623125327890739e-05,-4.273050301708281e-06
HR,Manufacture of ceramic goods,0.00034477757192775607,-0.0004931266560405492,-3.8677231568843124e-05
HR,"Manufacture of bricks, tiles and construction products, in baked clay",0.0018114916879236698,-0.001034305001065135,0.001153808132082224
HR,"Manufacture of cement, lime and plaster",0.023915228643894195,-0.014197329834938049,0.014611791492700577
HR,Re-processing of ash into clinker,0.003519382901400328,-0.0021468464004993438,0.00209225203704834
HR,Manufacture of other non-metallic mineral products n.e.c.,0.010521832258686423,-0.003953257321879268,0.00834362928238511
HR,Manufacture of basic iron and steel and of ferro-alloys and first products thereof,0.00023513462087512016,-0.000992576164074242,-0.00037353075733035805
HR,Re-processing of secondary steel into new steel,0.0001716018827036023,-0.00029727223125845196,-4.4368135703727606e-05
HR,Precious metals production,3.83051059267018e-07,-1.2724017184882541e-06,-5.195178818539717e-07
HR,Re-processing of secondary preciuos metals into new preciuos metals,1.295478614338208e-11,-3.637218614107951e-08,-2.4636340074494002e-08
HR,Aluminium production,0.002980158461336978,-0.0009186668790122494,0.0025109755446254276
HR,Re-processing of secondary aluminium into new aluminium,0.007670733232892119,-0.0023308699995921926,0.0064826049094246704
HR,"Lead, zinc and tin production",6.706990059028613e-07,-1.8855672542267713e-06,-6.686865689407569e-07
HR,"Re-processing of secondary lead into new lead, zinc and tin",9.514885745556967e-08,-2.299655160823022e-07,-7.150367252143042e-08
HR,Copper production,9.409905923996121e-05,-0.002456387460993603,-0.0022710480697406455
HR,Re-processing of secondary copper into new copper,8.698771143564954e-06,-0.00033252344538783657,-0.00031244539347535463
HR,Other non-ferrous metal production,1.4443310088608995e-08,-8.698805950371024e-08,-4.2236958986904937e-08
HR,Re-processing of secondary other non-ferrous metals into new other non-ferrous metals,7.666079870296017e-08,-6.341331528983574e-08,3.406909493742205e-08
HR,Casting of metals,-8.87502372462,-8.87502372462,-8.87502372462
HR,"Manufacture of fabricated metal products, except machinery and equipment (28)",0.05749450347936153,-0.04138376500296593,0.03152842487859726
HR,Manufacture of machinery and equipment n.e.c. (29),0.00011762785256840288,-0.000177082782253623,3.614132106304169e-08
HR,Manufacture of office machinery and computers (30),5.349073629360646e-05,-4.384940936928615e-05,2.333978055231273e-05
HR,Manufacture of electrical machinery and apparatus n.e.c. (31),-0.0003251321845948696,-0.0010470380373485387,-0.0012156842363476752
HR,"Manufacture of radio, television and communication equipment and apparatus (32)",0.0006330265483856201,-0.0011551758607923986,-0.0002806339183151722
HR,"Manufacture of medical, precision and optical instruments, watches and clocks (33)",0.0005205958127528429,-0.00090033918556571,-9.558933202922345e-05
HR,"Manufacture of motor vehicles, trailers and semi-trailers (34)",3.6847550991922615e-05,-5.8954937369562685e-05,-6.146393239498138e-06
HR,Manufacture of other transport equipment (35),0.00043828585103154185,-0.00041599338177591565,0.00015495418399572372
HR,Manufacture of furniture; manufacturing n.e.c. (36),3.831459100916982e-05,-0.00026310072248801586,-0.00014955073845386506
HR,Recycling of waste and scrap,0.020699002814739943,-0.010828852998554706,0.013625951674848796
HR,Recycling of bottles by direct reuse,0.02091473882639408,-0.012296600655555726,0.013177849977970123
HR,Production of electricity by coal,0.016440297947406767,-0.047892891746521,-0.021623154591083528
HR,Production of electricity by gas,0.000699216377183795,-0.0011788233976960181,-0.00020637845906615259
HR,Production of electricity by nuclear,-0.99877985217,-0.99877985217,-0.99877985217
HR,Production of electricity by hydro,0.0012287245186194777,-0.0009410212668180466,0.0005688897842168808
HR,Production of electricity by wind,-0.0050215440345406535,-0.015575686601877213,-0.018316364831924437
HR,Production of electricity by petroleum and other oil derivatives,-0.0003267250387966633,-0.006930020960003137,-0.006065658905953169
HR,Production of electricity by biomass and waste,0.00013092731206025928,-0.00013668449839856475,3.0975383198820054e-05
HR,Production of electricity by solar photovoltaic,0.0,0.0,0.0
HR,Production of electricity by solar thermal,-17.6289433214,-17.6289433214,-17.6289433214
HR,"Production of electricity by tide, wave, ocean",0.0,0.0,0.0
HR,Production of electricity by Geothermal,-2.96559328848,-2.96559328848,-2.96559328848
HR,Production of electricity nec,-219.415654453,-219.415654453,-219.415654453
HR,Transmission of electricity,1.1283405805879737e-06,-2.0791320451535283e-06,-4.835830605588853e-07
HR,Distribution and trade of electricity,8.691211946746518e-15,-2.2454113590610753e-14,-8.985826403492062e-15
HR,Manufacture of gas; distribution of gaseous fuels through mains,6.495551643252839e-06,-6.677430021460168e-06,1.6059779727947897e-06
HR,Steam and hot water supply,0.013204044910192489,-0.03702715495252609,-0.015752799849271776
HR,"Collection, purification and distribution of water (41)",7.407177917473018e-05,-6.659239658340812e-05,2.6019674824550748e-05
HR,Construction (45),0.0003062981195449829,-0.00029676725363731387,9.029389256238938e-05
HR,Re-processing of secondary construction material into aggregates,1.9755113574210554e-06,-1.8173042174894363e-06,7.052866036538035e-07
HR,"Sale, maintenance, repair of motor vehicles, motor vehicles parts, motorcycles, motor cycles parts and accessoiries",3.8920957104302944e-05,-3.19092218298465e-05,1.6405368154868485e-05
HR,Retail sale of automotive fuel,0.0001975584607217461,-0.00015561209655739366,8.993684509582817e-05
HR,"Wholesale trade and commission trade, except of motor vehicles and motorcycles (51)",0.0003726202975250781,-0.0003125318399332464,0.00016699486769735812
HR,"Retail trade, except of motor vehicles and motorcycles; repair of personal and household goods (52)",4.3134406263940035e-05,-3.802838406898081e-05,1.9079782146029175e-05
HR,Hotels and restaurants (55),0.0008347801137119532,-0.0015716097325980663,-0.00035671010072529317
HR,Transport via railways,0.0006600536073893309,-0.0004850765430778265,0.0003339110107570887
HR,Other land transport,1.9135140782418603e-07,-1.7893607626501762e-07,5.996426569254254e-08
HR,Transport via pipelines,3.257185388461221e-05,-1.3064302681596018e-05,2.5061347117938566e-05
HR,Sea and coastal water transport,0.023431114072322845,-0.033112901551246646,-0.0010599419600963592
HR,Inland water transport,0.0012622302582710981,-0.0026195100157558916,-0.0007146363781541586
HR,Air transport (62),0.004843600708663464,-0.004308911672055721,0.00177997468572855
HR,Supporting and auxiliary transport activities; activities of travel agencies (63),0.00012095083770528436,-0.00011359298580884934,3.997542588785291e-05
HR,Post and telecommunications (64),0.00010094585831090808,-0.00011809003467485309,1.1983510702848435e-05
HR,"Financial intermediation, except insurance and pension funding (65)",0.0002934083036407828,-0.0002754579518139362,9.728507463634015e-05
HR,"Insurance and pension funding, except compulsory social security (66)",0.0001233769412515685,-0.00011168802587129175,4.523743177577853e-05
HR,Activities auxiliary to financial intermediation (67),0.0013712690251916648,-0.001123890144482255,0.000566898720100522
HR,Real estate activities (70),0.00012747849138081073,-0.00013469333725422622,3.0442106068134308e-05
HR,Renting of machinery and equipment without operator and of personal and household goods (71),0.0001893262651786208,-0.0001520468998933211,8.122304382827133e-05
HR,Computer and related activities (72),3.218260085955262e-05,-3.0976035413332283e-05,1.0235744978301227e-05
HR,Research and development (73),8.941910514608026e-05,-0.0003591972374841571,-0.00019062723241001367
HR,Other business activities (74),0.0013954563894718885,-0.0011501402186453343,0.0005692860693186522
HR,Public administration and defence; compulsory social security (75),1.6116793051362037e-05,-1.5034404814243316e-05,5.499054208397865e-06
HR,Education (80),2.4491861656308173e-05,-2.875669262185693e-05,3.6881267316639425e-06
HR,Health and social work (85),2.5449583545327185e-05,-2.093910598754883e-05,1.0880675047636032e-05
HR,Incineration of waste: Food,-0.0956035875114,-0.0956035875114,-0.0956035875114
HR,Incineration of waste: Paper,-0.292588895608,-0.292588895608,-0.292588895608
HR,Incineration of waste: Plastic,-0.0393783878371,-0.0393783878371,-0.0393783878371
HR,Incineration of waste: Metals and Inert materials,3.2160664872033525e-05,-2.5347355775069446e-05,1.364013197668828e-05
HR,Incineration of waste: Textiles,-0.0181468869147,-0.0181468869147,-0.0181468869147
HR,Incineration of waste: Wood,-0.0283078260985,-0.0283078260985,-0.0283078260985
HR,Incineration of waste: Oil/Hazardous waste,2.1654088945593684e-05,-2.285242244321853e-05,4.085411408334039e-06
HR,"Biogasification of food waste, incl. land application",-0.0167858180378,-0.0167858180378,-0.0167858180378
HR,"Biogasification of paper, incl. land application",-5.1322109392899996e-15,-5.1322109392899996e-15,-5.1322109392899996e-15
HR,"Biogasification of sewage slugde, incl. land application",0.004348310924977064,-0.0031317150673568247,0.002191129507794976
HR,"Composting of food waste, incl. land application",2.4267906306893564e-05,-2.06612900987966e-05,8.760971964336931e-06
HR,"Composting of paper and wood, incl. land application",-0.00043886671281000004,-0.00043886671281000004,-0.00043886671281000004
HR,"Waste water treatment, food",0.00014397992117330433,-0.00011778918284364045,5.5129043525084856e-05
HR,"Waste water treatment, other",0.0002592235369645059,-0.00026604096000269056,5.689175028912723e-05
HR,Landfill of waste: Food,0.032968316779494286,-0.02330446121573448,0.01647569097042084
HR,Landfill of waste: Paper,0.026724169252634048,-0.016564185910820962,0.015397212490320205
HR,Landfill of waste: Plastic,0.0004310015451880172,-0.0002935694452850148,0.0002231779985204339
HR,Landfill of waste: Inert/metal/hazardous,0.002311205020673573,-0.001025006327237934,0.0016804664478711783
HR,Landfill of waste: Textiles,0.0023817227594554423,-0.001726180377215147,0.001152030189216137
HR,Landfill of waste: Wood,0.0005957564651183784,-0.00044865549300611017,0.0002742000806741416
HR,Activities of membership organisation n.e.c. (91),9.403943371027708e-06,-8.192677270621061e-06,3.6045858059078455e-06
HR,"Recreational, cultural and sporting activities (92)",5.3716189444065096e-05,-7.187219969928264e-05,1.529492363333702e-07
